[
 {
  "id": "BT:t1-open-01",
  "kind": "topic",
  "area": "speaking",
  "group": "S1",
  "teil": "S1",
  "fn": "t1_open",
  "star": true,
  "trap": null,
  "focus": [
   "word-choice"
  ],
  "strict": [],
  "plan": "choice",
  "task": null,
  "prompt": "Teil 1: you two are planning a party for Friday. Open the planning and ask your partner where to start.",
  "prompt_lang": "en",
  "hl": null,
  "partner": "Hallo! Na, wollen wir anfangen?",
  "prefill": null,
  "accept": [
   "wir sollen ja [x] planen",
   "sollen wir mit [x] anfangen",
   "womit fangen wir an",
   "was meinst du",
   "was denkst du",
   "was schlägst du vor",
   "wo fangen wir an",
   "hast du schon eine idee"
  ],
  "anywhere": true,
  "model": "Wir sollen ja die Party am Freitag planen. Sollen wir mit dem Termin anfangen?",
  "wrong": [],
  "rule": "To open Teil 1, name the task and hand over a question: Wir sollen ja eine Party planen, was meinst du?",
  "src": "cheatsheet §4 Einstieg und Vorschläge",
  "chunk": null,
  "level": "B1"
 },
 {
  "id": "BT:t1-open-02",
  "kind": "topic",
  "area": "speaking",
  "group": "S1",
  "teil": "S1",
  "fn": "t1_open",
  "star": true,
  "trap": null,
  "focus": [
   "word-choice"
  ],
  "strict": [],
  "plan": "choice",
  "task": null,
  "prompt": "You're planning a farewell for a colleague. Start the planning and ask your partner when it should be.",
  "prompt_lang": "en",
  "hl": null,
  "partner": "Hallo! Was müssen wir denn alles planen?",
  "prefill": null,
  "accept": [
   "was meinst du wann [x]",
   "wann sollen wir [x]",
   "wann wollen wir [x]",
   "wir sollen ja [x] planen",
   "sollen wir mit dem termin anfangen",
   "was denkst du",
   "was schlägst du vor",
   "wann passt es dir"
  ],
  "anywhere": true,
  "model": "Was meinst du, wann sollen wir die Feier machen?",
  "wrong": [],
  "rule": "To open Teil 1, name the task and hand over a question: Wir sollen ja eine Party planen, was meinst du?",
  "src": "cheatsheet §4 Einstieg und Vorschläge",
  "chunk": null,
  "level": "B1"
 },
 {
  "id": "BT:t1-open-03",
  "kind": "topic",
  "area": "speaking",
  "group": "S1",
  "teil": "S1",
  "fn": "t1_open",
  "star": true,
  "trap": null,
  "focus": [
   "word-choice"
  ],
  "strict": [],
  "plan": "choice",
  "task": null,
  "prompt": "You're planning a weekend trip together. Hand the first decision to your partner: where should you go?",
  "prompt_lang": "en",
  "hl": null,
  "partner": "Also, ein Ausflug am Wochenende. Hast du eine Idee?",
  "prefill": null,
  "accept": [
   "was meinst du wohin [x]",
   "wohin sollen wir [x]",
   "wohin wollen wir [x]",
   "wo sollen wir [x]",
   "was schlägst du vor",
   "was meinst du",
   "was denkst du",
   "hast du (schon) eine idee"
  ],
  "anywhere": true,
  "model": "Was meinst du, wohin sollen wir fahren?",
  "wrong": [],
  "rule": "To open Teil 1, name the task and hand over a question: Wir sollen ja eine Party planen, was meinst du?",
  "src": "cheatsheet §4 Einstieg und Vorschläge",
  "chunk": null,
  "level": "B1"
 },
 {
  "id": "BT:t1-suggest-01",
  "kind": "topic",
  "area": "speaking",
  "group": "S1",
  "teil": "S1",
  "fn": "t1_suggest",
  "star": true,
  "trap": "verb-final",
  "focus": [
   "word-choice",
   "verb-final"
  ],
  "strict": [],
  "plan": "choice",
  "task": null,
  "prompt": "Your flat is big enough for the party. Suggest celebrating at your place.",
  "prompt_lang": "en",
  "hl": null,
  "partner": "Wo sollen wir die Party am Freitag machen?",
  "prefill": null,
  "accept": [
   "ich schlage vor dass wir [x]",
   "ich schlage vor wir [x]",
   "wie wäre es wenn wir [x]",
   "wir könnten (doch) (auch) [x]",
   "was hältst du davon wenn wir [x]",
   "wollen wir [x]",
   "sollen wir [x]",
   "lass uns [x]"
  ],
  "anywhere": true,
  "model": "Ich schlage vor, dass wir bei mir feiern.",
  "wrong": [
   "Ich schlage vor, dass wir feiern bei mir."
  ],
  "rule": "To make a suggestion: Ich schlage vor, dass wir … / Wie wäre es, wenn wir …?",
  "src": "cheatsheet §4 Einstieg und Vorschläge",
  "chunk": null,
  "level": "B1"
 },
 {
  "id": "BT:t1-suggest-02",
  "kind": "topic",
  "area": "speaking",
  "group": "S1",
  "teil": "S1",
  "fn": "t1_suggest",
  "star": true,
  "trap": "verb-final",
  "focus": [
   "word-choice",
   "verb-final"
  ],
  "strict": [],
  "plan": "choice",
  "task": null,
  "prompt": "You know a nice park by the lake. Suggest having the picnic there.",
  "prompt_lang": "en",
  "hl": null,
  "partner": "Wo könnten wir das Picknick machen?",
  "prefill": null,
  "accept": [
   "wie wäre es wenn wir [x]",
   "wir könnten (doch) (auch) [x]",
   "ich schlage vor dass wir [x]",
   "ich schlage vor wir [x]",
   "wie wäre es mit [x]",
   "wollen wir [x]",
   "sollen wir [x]",
   "lass uns [x]"
  ],
  "anywhere": true,
  "model": "Wie wäre es, wenn wir in den Park am See gehen?",
  "wrong": [
   "Wie wäre es, wenn wir gehen in den Park am See?"
  ],
  "rule": "To make a suggestion: Ich schlage vor, dass wir … / Wie wäre es, wenn wir …?",
  "src": "cheatsheet §4 Einstieg und Vorschläge",
  "chunk": null,
  "level": "B1"
 },
 {
  "id": "BT:t1-suggest-03",
  "kind": "topic",
  "area": "speaking",
  "group": "S1",
  "teil": "S1",
  "fn": "t1_suggest",
  "star": true,
  "trap": "verb-final",
  "focus": [
   "word-choice",
   "verb-final"
  ],
  "strict": [],
  "plan": "choice",
  "task": null,
  "prompt": "For the course evening, suggest that everyone cooks something from their country.",
  "prompt_lang": "en",
  "hl": null,
  "partner": "Was machen wir beim Kursabend?",
  "prefill": null,
  "accept": [
   "wir könnten (doch) (auch) [x]",
   "ich schlage vor dass [x]",
   "ich schlage vor [x]",
   "wie wäre es wenn [x]",
   "was hältst du davon wenn [x]",
   "wollen wir [x]",
   "sollen wir [x]",
   "lass uns [x]"
  ],
  "anywhere": true,
  "model": "Wir könnten doch alle etwas aus unserem Land kochen.",
  "wrong": [
   "Wie wäre es, wenn jeder kann etwas aus seinem Land kochen?"
  ],
  "rule": "To make a suggestion: Ich schlage vor, dass wir … / Wie wäre es, wenn wir …?",
  "src": "cheatsheet §4 Einstieg und Vorschläge",
  "chunk": null,
  "level": "B1"
 },
 {
  "id": "BT:t1-accept-01",
  "kind": "topic",
  "area": "speaking",
  "group": "S1",
  "teil": "S1",
  "fn": "t1_accept",
  "star": true,
  "trap": null,
  "focus": [
   "word-choice"
  ],
  "strict": [],
  "plan": "choice",
  "task": null,
  "prompt": "You like the idea. Say yes to it.",
  "prompt_lang": "en",
  "hl": null,
  "partner": "Wir könnten doch bei mir feiern. Ich habe einen großen Garten.",
  "prefill": null,
  "accept": [
   "gute idee",
   "finde ich gut",
   "ich finde das gut",
   "einverstanden",
   "das klingt gut",
   "das hört sich gut an",
   "das gefällt mir",
   "tolle idee"
  ],
  "anywhere": true,
  "model": "Gute Idee! Ein Garten ist perfekt für eine Party.",
  "wrong": [],
  "rule": "To accept a suggestion: Gute Idee! / Das finde ich gut. / Einverstanden.",
  "src": "cheatsheet §4 Reagieren: ja, jein, nein",
  "chunk": null,
  "level": "B1"
 },
 {
  "id": "BT:t1-accept-02",
  "kind": "topic",
  "area": "speaking",
  "group": "S1",
  "teil": "S1",
  "fn": "t1_accept",
  "star": true,
  "trap": null,
  "focus": [
   "word-choice"
  ],
  "strict": [],
  "plan": "choice",
  "task": null,
  "prompt": "A voucher is a great present for your friend. Agree.",
  "prompt_lang": "en",
  "hl": null,
  "partner": "Wie wäre es mit einem Gutschein für Lena? Dann kann sie selbst etwas aussuchen.",
  "prefill": null,
  "accept": [
   "das finde ich gut",
   "ich finde das gut",
   "gute idee",
   "einverstanden",
   "das klingt gut",
   "das hört sich gut an",
   "das ist eine schöne idee",
   "super idee"
  ],
  "anywhere": true,
  "model": "Das finde ich gut. Lena kauft gern selbst ein.",
  "wrong": [],
  "rule": "To accept a suggestion: Gute Idee! / Das finde ich gut. / Einverstanden.",
  "src": "cheatsheet §4 Reagieren: ja, jein, nein",
  "chunk": null,
  "level": "B1"
 },
 {
  "id": "BT:t1-accept-03",
  "kind": "topic",
  "area": "speaking",
  "group": "S1",
  "teil": "S1",
  "fn": "t1_accept",
  "star": true,
  "trap": null,
  "focus": [
   "word-choice"
  ],
  "strict": [],
  "plan": "choice",
  "task": null,
  "prompt": "Ten o'clock at your friend's flat works for you. Say so.",
  "prompt_lang": "en",
  "hl": null,
  "partner": "Ich schlage vor, dass wir uns um zehn Uhr bei Tom treffen.",
  "prefill": null,
  "accept": [
   "das passt mir (gut)",
   "ja das passt",
   "einverstanden",
   "geht klar",
   "das geht",
   "gute idee",
   "das klingt gut",
   "abgemacht"
  ],
  "anywhere": true,
  "model": "Ja, das passt mir gut.",
  "wrong": [],
  "rule": "To accept a suggestion: Gute Idee! / Das finde ich gut. / Einverstanden.",
  "src": "cheatsheet §4 Reagieren: ja, jein, nein",
  "chunk": null,
  "level": "B1"
 },
 {
  "id": "BT:t1-reject-01",
  "kind": "topic",
  "area": "speaking",
  "group": "S1",
  "teil": "S1",
  "fn": "t1_reject",
  "star": true,
  "trap": "verb-final",
  "focus": [
   "word-choice",
   "verb-final"
  ],
  "strict": [],
  "plan": "choice",
  "task": null,
  "prompt": "The forecast for Sunday is bad. Turn the idea down politely and give the reason.",
  "prompt_lang": "en",
  "hl": null,
  "partner": "Wir könnten am Sonntag im Park picknicken.",
  "prefill": null,
  "accept": [
   "das ist zwar eine gute idee aber [x]",
   "ich weiß nicht ob das klappt weil [x]",
   "das geht leider nicht weil [x]",
   "da bin ich mir nicht (so) sicher",
   "ich bin mir nicht sicher ob [x]",
   "tut mir leid aber [x]",
   "ich weiß nicht ob [x]",
   "leider soll es [x] regnen"
  ],
  "anywhere": true,
  "model": "Das ist zwar eine gute Idee, aber am Sonntag soll es regnen.",
  "wrong": [
   "Ich weiß nicht, ob das klappt, weil es soll am Sonntag regnen."
  ],
  "rule": "To turn down a suggestion politely: Das ist zwar eine gute Idee, aber … / Das geht leider nicht, weil …",
  "src": "cheatsheet §4 Reagieren: ja, jein, nein",
  "chunk": null,